"id","date","user_id","text","cluster"
2296,"2024-04-02",69,"С 01.01.2024 организации и индивидуальные предприниматели исполняющие обязанности налогового агента по НДФЛ уведомления об исчисленных суммах налогов авансовых платежей по налогам сборов страховых взносов представляют в следующие сроки (ст. 58 НК РФ пп. ""б"" п. 1 ст. 1 ч. 2 ст. 6 Федерального закона от 27.11.2023 N 539-ФЗ ""О внесении изменений в части первую и вторую Налогового кодекса Российской Федерации отдельные законодательные акты Российской Федерации и признании утратившими силу отдельных положений законодательных актов Российской Федерации""):
- не позднее 25-го числа текущего месяца - по налогу удержанному за период с 1-го по 22-е число текущего месяца;
- не позднее 3-го числа текущего месяца - по налогу удержанному за период с 23-го по последнее число предыдущего месяца;
- по НДФЛ удержанному с 23 по 31 декабря уведомление надо подать не позднее последнего рабочего дня года.
Согласно п. 6 ст. 226 НК РФ налоговые агенты обязаны перечислять суммы исчисленного и удержанного налога:
- за период с 1-го по 22-е число текущего месяца - не позднее 28-го числа текущего месяца;
- за период с 23-го числа по последнее число текущего месяца - не позднее 5-го числа следующего месяца;
- а за период с 23 по 31 декабря - не позднее последнего рабочего дня текущего года.
Заработная плата выплачивается не реже чем каждые полмесяца. Конкретная дата выплаты заработной платы устанавливается правилами внутреннего трудового распорядка коллективным договором или трудовым договором не позднее 15 календарных дней со дня окончания периода за который она начислена (ст. 136 Трудового кодекса РФ).
В рассматриваемой ситуации дата выплаты заработной платы приходится на 5-е и 20-е число месяца соответственно если после 23-го числа и до конца месяца не происходит выплат и удержания НДФЛ то оснований подавать уведомление не возникает.
Представление нулевого уведомления ЕНП законодательством не предусмотрено следовательно подавать уведомление ЕНП по НДФЛ следует один раз - до 25-го числа месяца.",2
2298,"2024-04-02",590,"Скажите есть кто ведёт таксопарк такси в Тинькофф? 
При сдаче отчётности УСН не было вопросов от налоговой?",1
2301,"2024-04-02",573,"Подскажите пожалуйста чем грозит отсутсвие к уплате налога на прибыль за 1 квартал? (Много расходов которые не возможно перенести на другой период- зп)",3
2308,"2024-04-03",464,"Добрый вечер. 
Я сама ездила в налоговую и ПФР и спрашивала что сдано а что нет. Компанию уже закрыла. Али луйя!!!",1
2319,"2024-04-03",573,"Здравствуйте. Подскажите. Пожалуйста Ип без работников применяет усн и патент. Как правильно уменьшить налоги усн и патент на фиксированные страховые взносы если при расчете пропорционально остаются не учтённые страховые взносы.
Большая часть страховых взносов приходится на патент а налог по патенту меньше чем сумма страховых взносов рассчитанных пропорционально",4
2322,"2024-04-03",47,"Если вы уверенычто эти % банк будет считать в налоговую базу по НДФЛто да УСН они не облагаются",1
2331,"2024-04-03",596,"Здравствуйте.  Подскажите пожалуйста- ип на усн 6% имеет одного сотрудника  платит ему зп взносы с этой за и ндфл. На сумму ндфл можно уменьшить налог ?",4
2335,"2024-04-03",597,"На НДФЛ нельзя можно на страховые взносы взносы от несчастных случаев фиксированные взносы и на превышение 1% если в прошлом году за 2023 не учитывали но не более чем на 50% от суммы налога.",4
2338,"2024-04-04",158,"Добрый вечер. Подскажите пожалуйста если отправлен Упрашенный баланс в налоговую через сбис 1 апреля но ещё не дошёл до налоговой можно его отозвать и направить новый если там нашли ощибку.",3
2348,"2024-04-04",137,"Уважаемые подскажите пожалуйста зачем налоговая отправляет требования по физ лицу который у нас когда то работал? Какие могут быть причины?",2
2370,"2024-04-04",69,"Согласно пп. 2 п. 2 ст. 346.17 НК РФ затраты на оплату стоимости товаров приобретенных для дальнейшей реализации учитываются в составе расходов при исчислении ""упрощенного"" налога с объектом налогообложения ""доходы минус расходы"" по мере реализации товаров.
В связи с этим если в период применения УСНО организация для дальнейшей перепродажи приобрела и оплатила товар который не был реализован в период применения указанного специального режима то она вправе учесть в целях исчисления налога на прибыль расходы на приобретение данного товара в периоде его реализации. Аналогичная позиция изложена в Определении ВС РФ от 06.03.2015 N 306-КГ15-289 по делу N А72-339/2014. См. Письмо ФНС России от 09.01.2018 N СД-4-3/6.",3
2375,"2024-04-05",603,"Коллеги добрый вечер!
Скажите сколько стоят услуги бухгалтера по ведению ИП /патент с 4-5 сотрудниками?",3
2397,"2024-04-05",345,"Коллеги доброй ночи! Подскажите пожалуйста ИП на УСН Доходы минус расходы зарегистрирован в Калмыкии а склад арендует в Санкт-Петербурге и товар отгружает. Торгует на маркетплейсах. В какую налоговую сдавать отчётность?",3
2421,"2024-04-06",612,"есть бухгалтера с школ?",1
2444,"2024-04-08",337,"Добрый день подскажите пожалуйста где можно посмотреть кбк и октмо для уплаты налога в бюджет и данные которые в декларацию идут для УСН доходы. г Екатеринбург",2
2445,"2024-04-08",337,"Добрый день подскажите пожалуйста где можно найти кбк и октмо для уплаты в бюджет налога по УСН доходы  которые указываются в декларации и что нужно указывать нужно за прошлый год указать налоги за весь год",4
2453,"2024-04-08",567,"Добрый день. Для НДС налоговый период- квартал. Подаем декларацию за 4кв. А вот бух отчетность считается с даты создания 21.12.23  по 31.12.24.",2
2455,"2024-04-08",567,"не забывайте про налог на прибыль.",1
2464,"2024-04-08",63,"Отчетность по НДС (если нет освобождения по налогу). Для всего бизнеса предусмотрена специфика по отчетам по НДС. Если в 2023 году зарегистрировали фирму (ИП) до 18 декабря придется сдать первый отчет по НДС сразу за 4 квартал 2023. Если регистрация пришлась в 2023 году на 18 декабря или более позднюю дату первый отчет по НДС сдавайте по итогам 1 квартала 2024 за период со дня создания бизнеса по 31 марта 2024.",2
2469,"2024-04-08",624,"Доброго времени суток! Недавно открыли ИП ( патент и сотрудники выполняющие этот вид деятельности + УСН) доходы были как по патентной деятельности так и продажа товаров доп оквэд на это был открыт вопрос: налог усн за 2023 г можно уменьшить на страховые взносы если сотрудники как бы приняты в организацию по патентной деятельности? И второй вопрос 1с при формирование отчетности за первый квартал 2024 год уменьшает налог усн пропорционально доходам по усн.. соотвественно уменьшить налог усн на маленькую сумму удается думали на страховые взносы ип фиксированных взносов за себя в 2024 году 49500 =24750 уменьшить расчет ошибка в программе где то не так отражение стоит или только пропорционально доходу это все можно уменьшить??? Патент 50% уменьшение от взносов с зп сотрудников УСН 50% с фиксированного взносы ИП за самого себя?? Или мы путает сладкое с твердым… заранее благодарю за ответы 🙏",4
2477,"2024-04-09",627,"Добрый вечер подскажите пожалуйста как в 1С провести операцию оплата налогов ИП была не через р/сч а по карте . Есть только чеки.",2
2490,"2024-04-09",63,"Сбербанк почему то всем так советует раньше налоговая не придирались но лучше про ЗП не писать",1
2504,"2024-04-10",438,"Добрый день коллеги. 
Нужна помощь по ВЭД. 
Казахи привезли товар из Китая в Казахстан  оформив транзитку и разместили его  под импорт-70 Продают товар в РФ на dap. Не растаможенный.  Утверждают что юр лицо РФ сами таможат по импорт 40. Возможно ли это на практике? Тут ведь косвенный налог возникает.",2
2517,"2024-04-10",634,"Добрый день. ООО зарегистрирована 11.10.2023. Бухотчетность не сдала т.к. срок для созданной организации наступит только в 2025 году. В личном кабинете ифнс появилась информация о блокировке счета из-за несдачи отчетности. Я написала запрос в налоговую ответа пока нет. Может у кого-то была такая же ситуация чем все завершилось?",2
2522,"2024-04-10",10,"Здравствуйте. подскажите пожалуйста если пришло уведомление из налоговой только по почте россии с запросом явиться на беседу с предоставлением документов по выданному подотчетумы имеем право не предоставлять документы и не являться?",1
2530,"2024-04-10",10,"по ткс налоговая не отправляла. а если вообще не отправлять доки то могут подотчет доначислить как доход? по уведомлению имеют право?",2
2541,"2024-04-11",162,"Здравствуйте! Как составить возражение на акт по штрафу от налоговой за непредставление ответа на требование? На самом деле представляли но позже после предоставления уведомления о невозможности представления в срок (ответ на уведомление не получали)",3
2567,"2024-04-11",146,"Добрый день ИП занимается ремонтом автомобилей. 
В 1 квартале как оказалось работал на НДС так как не получил патент во время а УСН не было.
Вопрос: На услуги которые он предоставлял  и оплаты которые он получил просто сделать УПД с НДС? 
НДС в том числе ?",2
2576,"2024-04-12",651,"Добрый день . Помогите пожалуйста разобраться . У нас есть Заказчики из Казахстана они м/б как ФЛ так и ЮЛ . Наша организация на УСН 6% является Исполнителем( Российская организация) по оказанию рекламных услуг и сопровождению информационных систем продажа лицензий ПО.

Согласно нормативным документам территорией оказания данных услуг является Казахстан. При оплате ФЛ на расчетный счет мы должны отправить чек как и при покупке гражданам РФ? При оплате ЮЛ  нужно согласовать с банком нюансы валютных операций даже если перечисление в рублях. Какие дополнительные документы и отчеты нужно сдать при данном экспорте? налоги остаются те же  что и при продаже в РФ?",2
2581,"2024-04-12",586,"Добрый день подскажите пожалуйста   пришло требование о предоставлении документов для камеральной проверке по декларации ндс если сдать уточненную декларацию - документы все равно нужно будет направлять?",2
2583,"2024-04-12",654,"Здравствуйте 
Коллеги подскажите пожалуйста 
Ип на усн 6%
Доход составил 1611000 за 2023 год
Уплачен ЕНП 57 000 один раз в 2023 году
Страховые взносы за себя ещё не платил за 2023 год

Налог Усн сколько составляет?

Затупила не могу понять
Страховые взносы составят же 58952?
Усн 96660?
Он должен оплатить Страховые? И к возврату составит налог 19292?",4
2599,"2024-04-13",327,"Доброго дня! Помогите советом. Пришло требование из налоговой по предоставлению 6 НДФЛ и РСВ. Он ИП без работников. Переводил с расчётного счета ИП себе на  личную карту деньги как зар.плата.(экономили на комиссии🤦‍♀️) Можно ли просто отписаться что Ип работает без сотрудников это личные средства предпринимателя после оплаты налогов? Кто сталкивался пожалуйста поделитесь 🙏",3
2600,"2024-04-13",388,"Налог надо смотреть по агентскому отчёту.",1
2603,"2024-04-13",246,"У него площадка на ВБ . Это не я решила а Он решил раз у него вознаграждение 1% то и Он должен платить налог с 1% я Ему посчитала 6% от отчета Вб",3
2607,"2024-04-13",388,"Если у договоре прописано  что он агент  ищет покупателей для принципала  и на основании отчета делает свой отчёт агента  передаёт заказчику. 
То есть вероятность что ему не нужно платить налог со всей суммы реализации.",1
2609,"2024-04-13",10,"в сверке указано уменьшен налог по уведомлению  это что сумма по уведомлениюкоторое подавали ?",0
2613,"2024-04-13",388,"А то что это не его товары не волнует налоговую)",1
2615,"2024-04-13",388,"Вы ему объясните  что если рассчитаете налог по 1%  налоговая свершит данные по выписке  запросит пояснения по декларации. 
А там и от штрафа недалеко за занижение налоговой базы.",1
2618,"2024-04-13",388,"Просто по 1% если делать там сто пудов будет запрос налоговой по пояснениям",3
2621,"2024-04-13",10,"подскажите пожалуйста отмена операции  уведомление об исчисленных суммах налогов с минусом суммы в сверке это что?",0
2622,"2024-04-13",98,"Не поняла? 
Если с минусом сумма то вам начислила налоговая налог или вы подали уведомление. Как деньги придут на ЕНП  эта сумма спишется. Деньги придут сумма встанет +",0
2623,"2024-04-13",10,"начисляет налоговая из отчётов с фот или только берет из уведомлений?",1
2638,"2024-04-14",388,"Может у него регион где 1% ставка налога ?",3
2640,"2024-04-14",660,"Добрый вечер! Подскажите пожалуйста по такому вопросу: ИП доходы на УСН и ПНС в счёте в декабре 2023 включили услуги по УСН и ПНС. Как сейчас в декларации считать эту сумму поступления? Всю сумму в прибыль УСН получается теперь?",4
2645,"2024-04-14",660,"Покупатель оплатил одной суммой и в назначении платежа прописал оплата по счету за услуги которые на УСН",2
2683,"2024-04-15",559,"Проведите операцию ""Сведения об уплате налогов"".",1
2694,"2024-04-15",667,"Здравствуйте! Коллеги помогите пожалуйста разобраться.

ИП на ПСН и УСН 6%.
Имеются работники занятые только на ПСН.

Патент 2023 г.
Налог по патенту = 200 400р

УСН 2023 г. доход = 1 641 77360 руб.
Налог УСН 6% = 98 50642 р

Страховые взносы:
За работников оплачены в 2023 г. = 404 80881 р
Фиксированные страх.взносы за себя за 2023 г (оплачены в 2023г) = 45 842 р
Взносы 1% свыше 300тр за 2021 г (оплачены в 2023 году в 2021 был и патент и УСН)  = 4 40016
Взносы 1% свыше 300тр за 2022г (оплачены в 2023 году был только патент) = 18 20000
Взносы 1% свыше 300тр (не оплачены) за 2023 г = 48 81774

Если с патентом все понятно что можно уменьшить патент на 50% за счет страховых взносов уплаченных за сотрудников то по УСН возникает вопрос:
Можно ли учесть в уменьшение УСН страховые взносы (за себя и 1% свыше 300тр) ПОЛНОСТЬЮ или их нужно распределять пропорционально долям полученного дохода ПСН и УСН??
Доля УСН исходя из расчета доходов всего 673% а ПСН можем уменьшить только на 50%...поэтому большая часть страх.взносов просто ""потеряется""....Подскажите как сделать чтобы максимально использовать страх.взносы в уменьшение налогов?",4
2696,"2024-04-15",437,"Благотворительность от уплаты налогов не избавит но снизить налоговую нагрузку — поможет. Льгота по НДС действует только на товары работы и услуги которые компания подарила. При этом затраты которые понесла компания в процессе дарения не освобождаются от входного НДС.",2
2706,"2024-04-16",668,"Вы меня может не совсем правильно поняли. Допустим у вас выходит убыток налоговая это не любит но если вы можете подтвердить это - то вправе этим воспользоваться. Если не хотите лишних вопросов то часть расходов за 2023 год проведите 24 годом. Тем самым вы уменьшите убыток и можете сделать чтобы чуть доплатить налог. Так же и в 24 году если расходы будут превышать доход часть (в основном это услуги) можете провести 25годом. Потому как товар для продажи невозможно учесть в расходах позже то переносить можно услуги материалы для ОХР.",0
2711,"2024-04-16",668,"Более того нужно доплатить будет налог и пени заранее перед корректировкой если переплаты на ЕНС не было в срок уплаты.",0
2717,"2024-04-16",98,"Ну это ваше право. Но вы   показав убыток нарыли себе проверку. Теперь вам необходимо предоставить все документы согласно кудир и доказать этот убыток. И минимальный налог 1% всё равно платите.",0
