"id","date","user_id","text","cluster"
4516,"2024-06-28",59,"Здравствуйте коллеги!☀️
ИП на УСН доходы-расходы Саратов оквэд 79.11. 
Пришло такое требование о неправомерном применении ставки налога налоговая ссылается на пункт закона который относится к УСН Доходы и ещё п.6 ст.2. Прекратил действие с 01.01.2023 г. - Закон Саратовской области от 18 февраля 2021 г. N 18-ЗСО.

Налоговой так и ответить ""вы ссылаетесь на статью которая отменена не относится к нашей системе налогообл.""? Посоветуйте пожалуйста как лучше ответить🙏 

И ещё вопрос — нам подходит пп.12 13 ст.2 но там условие — ""соответствующих одновременно следующим требованиям"" (доля доходов и среднемесячная зп работников). 
Как считаете может ли этот ИП применять льготную ставку налога?  если ИП один и у него нет сотрудников",3
4518,"2024-06-28",331,"Зайдите в личный кабинет ИП налоговой там в разделе страховые взносы за вас ФНС уже посчитали за 2023г на основании отчетности и тд.",3
4522,"2024-06-28",242,"Нет если запросит налоговая дополнительно то пришлёте",0
4531,"2024-06-29",125,"Добрый вечер. У нас вот буквально недавно была такая же ситуация ОкВЭД 47.91 у нас в списке 47.91.2. Мы звонили в налоговую за консультацией сказали относится но по факту как оказалосьчто нет. Сдали декларацию кор.1 заплатили налог и сверху накинули на пеничтоб енс был положительный.",2
4539,"2024-06-30",599,"Добрый день налоговая прислала требование с предоставлением пояснения и запросила кудир (доход-расход) из-за расхождения денежных средств в декларации и оборота по банку. Нашла расхождения подготовила корректировку. При сдачи корректировки нужно составлять пояснение? при составлении кудир обязательно указывать договора по оплате или можно оставить «оплата без договора»? Налоговая на это обращает внимание?",2
4542,"2024-07-01",599,"Добрый день юр и физ лицам. Для налоговой нужно указывать договора?",1
4578,"2024-07-02",7,"Здравствуйте.  Нужен совет. В 2023 году ООО было на УСН. По состоянию на 31.12. 2023 в балансе отражена дебиторская  задолженность в сумме 1226000. В 2024 году ООО решило стать на ОСНО (мотивы неизвестныдеятельность не ведётся). Сейчас пришло требование от ФНС о необходимости отражения данной дебиторской задолженности в части доходов (основание п.2 ст. 34625 НК РФ). 

В целом логично. При усн продали налог не заплатили теперь платите при ОСНО. Но директор платить не желает (нечем собственно). Может есть идеи как выйти из этой ситуации с наименьшими потерями?",4
4592,"2024-07-03",1030,"Здравствуйте. Подскажите пожалуйста ИП на патенте «деятельность специализированную в области дизайна услуги художественного оформления» может принимать оплаты от ИП и компаний?",3
4611,"2024-07-04",547,"Коллеги добрый день!
1С 8.3 бухгалтерия. 

При расчете налога ООО по УСН Доходы в документе Отчетность по УСН программа не учитывает страх взносы уплаченные на травматизм и соответственно не уменьшает налог на эти взносы.
Кто нибудь сталкивался с такой проблемой?",4
4614,"2024-07-05",779,"Добрый вечер. В налоговом учете услуги по осуществлению нотариальных действий учитывают исключительно по утвержденным законом тарифам (подп. 16 п. 1 ст. 264 НК РФ). Расходы же сверх этих сумм не берутся в расчет налога на прибыль (п. 39 ст. 270 НК РФ).",3
4622,"2024-07-05",779,"На системе налогообложения доходы минус расходы 1% страховые взносов считается так: (доход - расход - 300 000 руб)*1%= сумма к уплате",0
4653,"2024-07-08",1046,"Здравствуйте. Решил освоить ввод документов через ЭДО с помощью загрузки документов в программу и распознавания. На моменте групповой обработки выскакивает такая вот ошибка. В УПД стоят услуги и программа не хочет их проводить требуя наличие товара в строке. 😀 Такая проблема только с УПД в которых фигурируют только услуги. Кто-то может подсказать? Заранее спасибо",2
4675,"2024-07-09",272,"Доброго вечера
Налоговая прислала требование физическому лицу о предоставлении документов на основании которых были получены векселя от компании «А» эти векселя в последствии были переданы компании «В» при заключении договора долевого участия на недвижимое имущество.
Налоговое мероприятие - выездная проверка в отношении компании «В»
Сделки проходили в 2017 году
Физическое лицо документы найти не может 
В связи с чем такой интерес может быть? И как лучше физику поступить ?",3
4701,"2024-07-10",772,"да правильно. А у вас не упрощенка? и еще интересно информационные и консультацинные услуги по переходу на электронную отчетность уже наверно не получится учесть?",2
4703,"2024-07-10",1056,"Здравствуйте подскажите пожалуйста работаем с озон но что то не пойму какая сумма принимается в качестве дохода  из какой колонки ? Пришло требование что у нас занижение налоговой базы и надо считать не с поступления дс на р/с.",1
4712,"2024-07-11",331,"Кто выяснил бухгалтер или налоговая? Если бухгалтер то пока ничего не делайте соберите и перечислите сначала ндс и ндфл на енс потом сдайте декларации вам налоговая насчитает дополнительно пени и штраф их перечислите.",0
4716,"2024-07-11",1057,"Добрый день !
Есть бухгалтеры у кого более 20 компаний в работе ?
По сотрудничеству интересно переговорить",2
4734,"2024-07-11",8,"Доброе утро! Столкнулась с такой проблемой обратился брат за помощью. У него УСН Д-Р. В 2024 перешли на ОСНО. За 2023 год бухгалтер сдала декларацию УСН показав доход в 155 млн. Не сказав ничего о поступивших требованиях улетела в отпуск. Налоговая вызвала директора и объявила что доход по данным банков 255 млн. Идет занижение базы. Потребовала с 4кв23 подать уведомление перейти на ОСНО и пересдать все. 

Я перекрыжила все счета каждый платеж поступивший. Доход 234 млн не больше! Я так понимаю он попадает под повышенный 20% д-р? В 2022 лимит до 2514 млн. 

Правильно мыслю что нужно даме с налоговой все доходы расписать доказать что в пределах лимита. Затем подать уведомление на повышенный % и доплатить за 4кв23 налог? Ну и декларацию пересдать.",4
4737,"2024-07-11",1057,"Добрый день !
Есть бухгалтеры у кого более 20 компаний в работе ?
По сотрудничеству интересно переговорить",2
4740,"2024-07-11",47,"У вас в ЛК Всё! имущество числится на фл. А вот вы самостоятельно могли поставить его на бухгалтерский/налоговый учёт у ИП. В налоговой ваше имущество не на ИПа на фл. Поэтому я и спрашиваю у вас- у вас в бухгалтерии на балансе ИП эта машина? 
Если дато непонятно почему ваш бухгалтер не отразил операции по ее выбытию в учёте ИП и не посчитал с этого налог. Смею только предположитьчто она это оставила 'на авось прокатит' ТК снятие имущества в ЛК  происходит по фл и чаще всего налоговая ждёт от фл отчётность по таким сделкам.",3
4749,"2024-07-11",1066,"Коллеги добрый день! Я начинающий бухгалтер и меня сразу кинули на бухгалтера в единственном лице🫣Подскажите пожалуйста ООО была создана в начале июне (ОСНО НДС) никаких оборотов не было. Какие отчёты нужно сдавать?",2
4764,"2024-07-12",437,"Легко формируется и налоговая принимает",0
4778,"2024-07-13",1070,"Извините а вы бухгалтер ? И собираетесь декларацию по НДС сдавать ?",2
4790,"2024-07-14",857,"Здравствуйте. Подскажите пожалуйста ИП на УСН доходы льготная ставка 1% имеет же право уменьшить налог на страховые взносы и на фиксы и за работников и на 1% с превышения дохода?",4
4792,"2024-07-14",857,"Ну просто льготная ставка не лишает ИП права уменьшить налог на страховые взносы.",4
4798,"2024-07-14",16,"Добрый день!
Скажите пожалуйста приобрели автомобиль в феврале этого года в апреле перевелись в другую налоговую. В конце апреля сдали уведомление в новую налоговую. Сегодня звонили с налоговой говорят нужно к ним сдавать так ли это?",2
4847,"2024-07-15",1075,"Добрый день!
Может сможете подсказать с какой базы считать НДФЛ для дохода от подаренных акций (код дохода 2721)? С базы по трудовым доходам или нужна отдельная база - налоговая база по доходам по операциям с ценными (п.2.1 ст210 НК РФ)",1
4860,"2024-07-16",35,"Коллеги добрый день подскажите пожалуйста. Ип на усн доходы заплатили в пфр 1% свыше 300 000 за 23 год и за 24 год. Можно уменьшить налог по усн на эти две суммы в 24 году?",4
4870,"2024-07-16",1057,"Добрый день !
Есть бухгалтеры у кого более 20 компаний в работе ?
По сотрудничеству интересно переговорить",2
4878,"2024-07-17",811,"Добрый вечер подскажите пожалуйста кто нибудь сталкивался с требованием от налоговой что только один кассир отражен в ККТ. Как отвечали на него?",3
4882,"2024-07-17",1076,"Добавлю сюда кусочек из того обзора … «Если оĸончание отчетного периода соответствующего авансового платежа наступило до принятия заявления о признании должниĸа банĸротом то таĸой авансовый платеж не является теĸущим. При этом оĸончание налогового периода после принятия судом заявления о признании должниĸа банĸротом влечет за собой ĸвалифиĸацию требования об уплате налога исчисленного по итогам налогового периода в ĸачестве теĸущего за исĸлючением авансовых платежей исчисленных за периоды предшествующие возбуждению дела о банĸротстве. Таĸим образом в этом случае налоговый орган имеет право на удовлетворение своих требований в режиме теĸущих платежей в размере определяемом ĸаĸ разница между суммой налога и суммой авансовых платежей требования об уплате ĸоторых не являются теĸущими..» тут речь совсем о другом. Спорный вопрос был в дате окончания периода НДС по-моему а не в формулировке которую они выдернули отсюда и пытаются перебить закон. А еще мне кажется что просто сократили фразу и «принятие судом заявления» на самом деле означает «признание обоснованным заявления»",2
4896,"2024-07-18",779,"Добрый день. Если вы в 2023 году не уменьшали налог за 2023 год  на эти страховые взносы потому что с 2023 года не по факту уплаты уменьшение то можно за 2024 год налог уменьшить и на взносы 2023 и на взносы 2024 года",4
4899,"2024-07-18",1076,"Я с арбитражными работала лет 10 но не плотно изредка фоном вела никогда не вникала в их дела  и не припомню чтоб были споры на эту тему с налоговой. Всегда для меня была важнее дата введения банкротства с этой даты отсчитывала вознаграждение эту дату и номер определения/решения указывала в обращениях в налоговую и т д. т. к. в шапке всех писем у арбитражных дата и номер решения когда их назначили ну и еще от этой даты отталкивалась при оформлении работников. Дата подачи заявления как-то не попадалась не помню Уверена была что в момент введения процедуры банкротства прекращается начисление пеней и в этот же момент задолженность делится на текущую и реестровую потому что все шло ровно по начислениям и пеням. Может так везло а может налоговые тоже не так как в этот раз дату определяли. Ну и когда я работала еще не было ЕНС. Насчет обоснованности немного поспорю. В первом определении написано что заявление будет проверено на обоснованность а во втором что оно признано обоснованным. Все точно как в ст 213.11. Поэтому я была уверена",3
4907,"2024-07-18",736,"А с каких сумм считать НДС? По р/с приходила оплата от физ.лиц за услуги",2
4922,"2024-07-18",61,"Нет расходы на покупку мебели в дом или квартиру учредителя при расчете налога на прибыль учитывать нельзя. Все расходы организации признаваемые в налоговой базе должны одновременно быть экономически обоснованны документально подтверждены и связаны с деятельностью направленной на получение дохода. Такой порядок предусмотрен пунктом 1 статьи 252 НК. В такой ситуации организация не сможет подтвердить обоснованность расходов использование мебели в интересах именно организации а не в личных интересах учредителя.

Принять к вычету входной НДС можно только при соблюдении всех условий для вычета при наличии счета-фактуры и в том случае если организация передаст это имущество в собственность учредителя оформит выдачу подарка. Со стоимости безвозмездно переданного имущества нужно начислять НДС поскольку ее приравнивают к реализации (п. 1 ст. 39 подп. 1 п. 1 ст. 146 п. 1 ст. 167 НК). Поэтому в этом случае входной НДС который поставщик предъявил при покупке имущества можно принять к вычету так как используете покупку в деятельности облагаемой НДС (подп. 1 п. 2 ст. 171 НК).",3
4925,"2024-07-19",679,"Всем здравствуйте. Такой вопрос
При формировании сведения об уплате налогов (страховые взносы за работников) в регистры подтягиваются прочие расчеты/расходы при усн строка расчетный документ заработная плата за 2023 год а должна за 2024 например январь и далее. Как с этим быть??",4
4926,"2024-07-19",1088,"Добрый вечер! Может кто-то в курсе налоговая ответила или какие-то объяснения к закону есть. Обязан ли ИП из РФ применяющий упрощенную систему налогообложения с объектом ""доходы""  при продаже товара через ЭТП покупателю-физлицу из Беларуси с 01.07.24 применять ст. 174.3 НК РФ т.е. уплачивать НДС при торговле через ЭТП в Беларуси Казахстана Армении. Или это положение относится только к ИП на ОСНО?",3
4928,"2024-07-19",61,"Добрый день! Нет оснований для вычета нет. По расходам которые не учитываются при расчете налога на прибыль входной НДС к вычету принять нельзя.",2
4931,"2024-07-19",834,"Конечно при наличие счёт-фактуры с НДС и оплаты с НДС приняла бы и для прибыли и НДС. Объективная причина.вполне конкретный расход экономически обоснован если деятельность реально ведётся доходы идут я не вижу причин придраться сейчас все подряд работают без офиса. Я уже 14 лет директор  фирма по моему домашнему адресу оказываю бух и транспортные услуги офиса нет не покупаю технику офисную мебельофисную канцелярию даже мойку уборку  квартиры оплачивала как разовые услуги т.к они вполне обоснованы в договоре прописан юр.адрес фирмы",2
4935,"2024-07-19",10,"Здравствуйте. подскажите  пожалуйста Уменьшают ли взносы по страхованию от несчастных случаев  налог по УСН?",4
4942,"2024-07-20",779,"Добрый день. Вам необходимо сдать НДС и 3-НДФЛ пересчитать налоги и оплатить.",2
4954,"2024-07-21",10,"Здравствуйте. подскажите пожалуйста оплаченные алименты уменьшают налог усн?",4
4955,"2024-07-21",779,"Добрый день.
В состав расходов при УСН попадают суммы причитающиеся сотруднику за выполняемую им работу или исполнение аналогичных обязанностей в соответствии с законодательством РФ. В состав этих сумм попадают в том числе (п. 2 ст. 346.16 НК):
 • вознаграждения за выполнение рабочих обязанностей;
 • мотивирующие выплаты (перечислены в ст. 255 НК РФ).
На такие зарплатные издержки организации полностью можно уменьшить налоговую базу при УСН.
Удерживаемые алименты - это часть заработка сотрудника. Соответственно они будут уменьшать доходы по УСН не как самостоятельный расход а в составе расходов на оплату труда (см. письмо Минфина РФ от 25.06.2009 № 03-11-09/225). ",4
4957,"2024-07-21",811,"Добрый вечер подскажите пожалуйста. Пришло требование что с бизнес карты ООО были различные покупки не относящиеся к деятельности. Директор с бизнес карты покупает абсолютно всё еда магазины поездка на такси. Как лучше отписаться налоговой по требованию по этим покупкам?",1
4964,"2024-07-22",964,"За 6 месяцев сумму налога удержанная по факту",3
